{
  "$schema": "../schema/plant-guide.schema.json",
  "id": "christmas-cactus",
  "name": "Christmas Cactus",
  "scientificName": "Schlumbergera",
  "hook": "Christmas cactus won't bloom? Give it long, cool nights.",
  "difficulty": "moderate",
  "tags": [
    "bright indirect",
    "flowering",
    "pet safe"
  ],
  "leafShape": "trailing",
  "palette": {
    "background": "#3A1F2B",
    "accent": "#FF6F91",
    "leaf": "#4E8A4F",
    "pot": "#E8E0D4"
  },
  "steps": [
    {
      "kind": "light",
      "title": "Bright, filtered light",
      "tip": "An east window is ideal. Hot, direct sun turns the stems pale and can burn them.",
      "sourceRefs": [0, 1, 2]
    },
    {
      "kind": "temperature",
      "title": "Long, cool autumn nights",
      "tip": "From mid-September, give it at least 13 hours of total darkness and 13–18°C nights until buds show.",
      "stat": "13+ hrs",
      "sourceRefs": [0, 1, 2]
    },
    {
      "kind": "water",
      "title": "Let the top dry out",
      "tip": "Water when the top few cm are dry, then empty the saucer. Standing water rots roots and makes buds drop.",
      "sourceRefs": [0, 1, 2]
    },
    {
      "kind": "fertilize",
      "title": "Feed through summer",
      "tip": "Give half-strength balanced fertilizer monthly while it grows in summer. Stop by the end of September.",
      "stat": "Monthly",
      "sourceRefs": [0, 1]
    },
    {
      "kind": "prune",
      "title": "Pinch tips for more flowers",
      "tip": "Flowers form at the stem tips, so pinch off a few segments in spring to make it branch. Root them as cuttings.",
      "sourceRefs": [1]
    }
  ],
  "outro": "Long, cool nights in autumn, then don't move it: blooms follow.",
  "sources": [
    {
      "title": "University of Minnesota Extension: Growing holiday cacti",
      "url": "https://extension.umn.edu/houseplants/holiday-cacti"
    },
    {
      "title": "RHS: How to grow Christmas cactus",
      "url": "https://www.rhs.org.uk/plants/christmas-cactus/how-to-grow"
    },
    {
      "title": "NC State Plant Toolbox: Schlumbergera",
      "url": "https://plants.ces.ncsu.edu/plants/schlumbergera/"
    },
    {
      "title": "ASPCA: Christmas Cactus (Schlumbergera bridgesii, non-toxic)",
      "url": "https://www.aspca.org/pet-care/animal-poison-control/toxic-and-non-toxic-plants/christmas-cactus"
    }
  ],
  "faqs": [
    {
      "question": "Why does my Christmas cactus drop its buds?",
      "answer": "Usually it's temperature swings, drafts from heaters or vents, moving the plant once buds form, or overwatering. Keep it in one steady spot.",
      "sources": [
        {
          "title": "University of Minnesota Extension: Growing holiday cacti",
          "url": "https://extension.umn.edu/houseplants/holiday-cacti"
        },
        {
          "title": "RHS: How to grow Christmas cactus",
          "url": "https://www.rhs.org.uk/plants/christmas-cactus/how-to-grow"
        }
      ]
    }
  ]
}
