{
  "$schema": "../schema/plant-guide.schema.json",
  "id": "fiddle-leaf-fig",
  "name": "Fiddle Leaf Fig",
  "scientificName": "Ficus lyrata",
  "hook": "Dropping leaves? Check water, light and drafts first.",
  "difficulty": "moderate",
  "tags": [
    "bright light",
    "statement plant",
    "toxic to pets"
  ],
  "leafShape": "round",
  "palette": {
    "background": "#24402F",
    "accent": "#F4A259",
    "leaf": "#3F7D3A",
    "pot": "#C9A96E"
  },
  "steps": [
    {
      "kind": "light",
      "title": "Bright light, near a window",
      "tip": "Place it near a bright window with filtered light, and shield it from hot afternoon sun."
    },
    {
      "kind": "water",
      "title": "Water when top 5 cm is dry",
      "tip": "Water deeply, then let it drain. Soggy soil can cause dark spots and leaf drop.",
      "stat": "Top 5 cm"
    },
    {
      "kind": "temperature",
      "title": "A steady spot above 13°C",
      "tip": "Keep it away from heaters, AC vents and doors, and give it a quarter turn each time you care for it.",
      "stat": "Above 13°C"
    },
    {
      "kind": "humidity",
      "title": "Wipe the big leaves",
      "tip": "Dust blocks light, so wipe the leaves with a damp cloth now and then. It likes medium to high humidity.",
      "stat": "Medium+"
    },
    {
      "kind": "fertilize",
      "title": "Feed in the growing season",
      "tip": "Use a high-nitrogen liquid fertilizer from spring to late summer, then feed less in winter.",
      "stat": "Spring–summer"
    }
  ],
  "climate": {
    "minTempC": 13,
    "idealTempC": [18, 27],
    "maxTempC": 32,
    "humidity": "average",
    "outdoors": "summer",
    "sourceRefs": [0, 1]
  },
  "outro": "Find its spot, then leave it alone. Consistency is everything.",
  "sources": [
    {
      "title": "RHS: How to grow ornamental figs",
      "url": "https://www.rhs.org.uk/plants/ornamental-figs/growing-guide"
    },
    {
      "title": "NC State Plant Toolbox: Ficus lyrata",
      "url": "https://plants.ces.ncsu.edu/plants/ficus-lyrata/"
    },
    {
      "title": "Penn State Extension: Fiddle Leaf Fig",
      "url": "https://extension.psu.edu/programs/master-gardener/counties/adams/news/fiddle-leaf-fig-ficus-lyrata"
    },
    {
      "title": "ASPCA: Is That Houseplant Safe for Your Pets?",
      "url": "https://www.aspca.org/news/houseplant-safe-your-pets"
    }
  ]
}
